<?xml version="1.0" encoding="UTF-8"?>
<jb-persistence-mapping xmlns:xsi="http://www.w3.org/2001/XMLSchema-instance"
	xsi:noNamespaceSchemaLocation="../../schema/jb-persistence-mapping.xsd">
	<entity class="org.jb.model.Produto">
		<web-entity>
			<insert>
				<path>http://192.168.25.7:8080/JBWebCrudApp/services/produtos/insert</path>
				<method>PUT</method>
				<consumedType>text/xml</consumedType>
			</insert>
			<update>
				<path>http://192.168.25.7:8080/JBWebCrudApp/services/produtos/update</path>
				<method>PUT</method>
				<consumedType>text/xml</consumedType>
			</update>
			<delete>
				<path>http://192.168.25.7:8080/JBWebCrudApp/services/produtos/delete/{id}</path>
				<method>DELETE</method>
				<pathParameters>
					<pathParam>
						<param>{id}</param>
					</pathParam>
				</pathParameters>
			</delete>
			<find>
				<path>http://192.168.25.7:8080/JBWebCrudApp/services/produtos/find</path>
				<method>POST</method>
				<producedType>text/xml</producedType>
				<queryParameters>
					<queryParam>
						<param>descricao</param>
					</queryParam>
					<queryParam>
						<param>valor</param>
					</queryParam>
				</queryParameters>
			</find>
			<findById>
				<path>http://192.168.25.7:8080/JBWebCrudApp/services/produtos/findById/{id}</path>
				<method>GET</method>
				<producedType>text/xml</producedType>
				<pathParameters>
					<pathParam>
						<param>{id}</param>
					</pathParam>
				</pathParameters>
			</findById>
			<findAll>
				<path>http://192.168.25.7:8080/JBWebCrudApp/services/produtos/all</path>
				<method>GET</method>
				<producedType>text/xml</producedType>
			</findAll>
		</web-entity>

		<attribute name="catalogos" type="java.util.List"
			enclosing-type="org.jb.model.Catalogo">
			<web-aggregation>
				<insert>
					<path>http://192.168.25.7:8080/JBWebCrudApp/services/produtos/addCatalogo</path>
					<method>POST</method>
					<producedType>text/xml</producedType>
					<queryParameters>
						<queryParam>
							<param>produto</param>
						</queryParam>
						<queryParam>
							<param>catalogo</param>
						</queryParam>
					</queryParameters>
				</insert>
				<delete>
					<path>http://192.168.25.7:8080/JBWebCrudApp/services/produtos/removeCatalogo</path>
					<method>POST</method>
					<producedType>text/xml</producedType>
					<queryParameters>
						<queryParam>
							<param>produto</param>
						</queryParam>
						<queryParam>
							<param>catalogo</param>
						</queryParam>
					</queryParameters>
				</delete>
				<list>
					<path>http://192.168.25.7:8080/JBWebCrudApp/services/produtos/listaCatalogos</path>
					<method>POST</method>
					<producedType>text/xml</producedType>
					<queryParameters>
						<queryParam>
							<param>produto</param>
						</queryParam>
					</queryParameters>
				</list>
			</web-aggregation>
		</attribute>
	</entity>
	<entity class="org.jb.model.Catalogo">
		<web-entity>
			<insert>
				<path>http://192.168.25.7:8080/JBWebCrudApp/services/catalogos/insert</path>
				<method>PUT</method>
				<consumedType>text/xml</consumedType>
			</insert>
			<update>
				<path>http://192.168.25.7:8080/JBWebCrudApp/services/catalogos/update</path>
				<method>PUT</method>
				<consumedType>text/xml</consumedType>
			</update>
			<delete>
				<path>http://192.168.25.7:8080/JBWebCrudApp/services/catalogos/delete/{id}</path>
				<method>DELETE</method>
				<pathParameters>
					<pathParam>
						<param>{id}</param>
					</pathParam>
				</pathParameters>
			</delete>
			<find>
				<path>http://192.168.25.7:8080/JBWebCrudApp/services/catalogos/find</path>
				<method>POST</method>
				<producedType>text/xml</producedType>
				<queryParameters>
					<queryParam>
						<param>descricao</param>
					</queryParam>
					<queryParam>
						<param>valor</param>
					</queryParam>
				</queryParameters>
			</find>
			<findById>
				<path>http://192.168.25.7:8080/JBWebCrudApp/services/catalogos/findById/{id}</path>
				<method>GET</method>
				<producedType>text/xml</producedType>
				<pathParameters>
					<pathParam>
						<param>{id}</param>
					</pathParam>
				</pathParameters>
			</findById>
			<findAll>
				<path>http://192.168.25.7:8080/JBWebCrudApp/services/catalogos/all</path>
				<method>GET</method>
				<producedType>text/xml</producedType>
			</findAll>
		</web-entity>

		<attribute name="produtos" type="java.util.List"
			enclosing-type="org.jb.model.Produto">
			<web-aggregation>
				<insert>
					<path>http://192.168.25.7:8080/JBWebCrudApp/services/catalogos/addProduto</path>
					<method>POST</method>
					<producedType>text/xml</producedType>
					<queryParameters>
						<queryParam>
							<param>catalogo</param>
						</queryParam>
						<queryParam>
							<param>produto</param>
						</queryParam>
					</queryParameters>
				</insert>
				<delete>
					<path>http://192.168.25.7:8080/JBWebCrudApp/services/catalogos/removeProduto</path>
					<method>POST</method>
					<producedType>text/xml</producedType>
					<queryParameters>
						<queryParam>
							<param>catalogo</param>
						</queryParam>
						<queryParam>
							<param>produto</param>
						</queryParam>
					</queryParameters>
				</delete>
				<list>
					<path>http://192.168.25.7:8080/JBWebCrudApp/services/catalogos/listaProdutos</path>
					<method>POST</method>
					<producedType>text/xml</producedType>
					<queryParameters>
						<queryParam>
							<param>catalogo</param>
						</queryParam>
					</queryParameters>
				</list>
			</web-aggregation>
		</attribute>

		<method name="adicionarProduto" type="void" enclosing-type="void">
			<web-action>
				<request>
					<path>http://192.168.25.7:8080/JBWebCrudApp/services/catalogos/addProduto</path>
					<method>POST</method>
					<producedType>text/xml</producedType>
					<queryParameters>
						<queryParam>
							<param>catalogo</param>
						</queryParam>
						<queryParam>
							<param>produto</param>
						</queryParam>
					</queryParameters>
				</request>
			</web-action>
		</method>
	</entity>
	<entity class="org.jb.model.Pedido">
		<web-entity>
			<insert>
				<path>http://192.168.25.7:8080/JBWebCrudApp/services/pedidos/insert</path>
				<method>PUT</method>
				<consumedType>text/xml</consumedType>
			</insert>
			<update>
				<path>http://192.168.25.7:8080/JBWebCrudApp/services/pedidos/update</path>
				<method>PUT</method>
				<consumedType>text/xml</consumedType>
			</update>
			<delete>
				<path>http://192.168.25.7:8080/JBWebCrudApp/services/pedidos/delete/{id}</path>
				<method>DELETE</method>
				<pathParameters>
					<pathParam>
						<param>{id}</param>
					</pathParam>
				</pathParameters>
			</delete>
			<find>
				<path>http://192.168.25.7:8080/JBWebCrudApp/services/pedidos/find</path>
				<method>POST</method>
				<producedType>text/xml</producedType>
				<queryParameters>
					<queryParam>
						<param>nome</param>
					</queryParam>
					<queryParam>
						<param>sexo</param>
					</queryParam>
					<queryParam>
						<param>dataDeNascimento</param>
					</queryParam>
				</queryParameters>
			</find>
			<findById>
				<path>http://192.168.25.7:8080/JBWebCrudApp/services/pedidos/findById/{id}</path>
				<method>GET</method>
				<producedType>text/xml</producedType>
				<pathParameters>
					<pathParam>
						<param>{id}</param>
					</pathParam>
				</pathParameters>
			</findById>
			<findAll>
				<path>http://192.168.25.7:8080/JBWebCrudApp/services/pedidos/all</path>
				<method>GET</method>
				<producedType>text/xml</producedType>
			</findAll>
		</web-entity>

		<attribute name="itens" type="java.util.List"
			enclosing-type="org.jb.model.Item">
			<web-composition>
				<list>
					<path>http://192.168.25.7:8080/JBWebCrudApp/services/itens/find</path>
					<method>POST</method>
					<producedType>text/xml</producedType>
					<queryParameters>
						<queryParam>
							<param>pedido</param>
						</queryParam>
					</queryParameters>
				</list>
			</web-composition>
		</attribute>
	</entity>
	<entity class="org.jb.model.Item">
		<web-entity>
			<insert>
				<path>http://192.168.25.7:8080/JBWebCrudApp/services/itens/insert</path>
				<method>PUT</method>
				<consumedType>text/xml</consumedType>
			</insert>
			<update>
				<path>http://192.168.25.7:8080/JBWebCrudApp/services/itens/update</path>
				<method>PUT</method>
				<consumedType>text/xml</consumedType>
			</update>
			<delete>
				<path>http://192.168.25.7:8080/JBWebCrudApp/services/itens/delete/{id}</path>
				<method>DELETE</method>
				<pathParameters>
					<pathParam>
						<param>{id}</param>
					</pathParam>
				</pathParameters>
			</delete>
			<find>
				<path>http://192.168.25.7:8080/JBWebCrudApp/services/itens/find</path>
				<method>POST</method>
				<producedType>text/xml</producedType>
				<queryParameters>
					<queryParam>
						<param>pedido</param>
					</queryParam>
					<queryParam>
						<param>produto</param>
					</queryParam>
					<queryParam>
						<param>quantidade</param>
					</queryParam>
					<queryParam>
						<param>valor</param>
					</queryParam>
				</queryParameters>
			</find>
			<findById>
				<path>http://192.168.25.7:8080/JBWebCrudApp/services/itens/findById/{id}</path>
				<method>GET</method>
				<producedType>text/xml</producedType>
				<pathParameters>
					<pathParam>
						<param>{id}</param>
					</pathParam>
				</pathParameters>
			</findById>
			<findAll>
				<path>http://192.168.25.7:8080/JBWebCrudApp/services/itens/all</path>
				<method>GET</method>
				<producedType>text/xml</producedType>
			</findAll>
		</web-entity>

	</entity>
	<entity class="org.jb.model.Cliente">
		<web-entity>
			<insert>
				<path>http://192.168.25.7:8080/JBWebCrudApp/services/clientes/insert</path>
				<method>PUT</method>
				<consumedType>text/xml</consumedType>
			</insert>
			<update>
				<path>http://192.168.25.7:8080/JBWebCrudApp/services/clientes/update</path>
				<method>PUT</method>
				<consumedType>text/xml</consumedType>
			</update>
			<delete>